{
  "aircraft": "Christen Eagle II",
  "displayName": "Christen Eagle II",
  "isHelicopter": false,
  "emptyWeight": 1429,
  "maxTakeoffWeight": 1601,
  "internalFuel": 157,
  "cmdsCapacity": 0,
  "chaffIncrement": 1,
  "flareIncrement": 1,
  "defaultChaff": 0,
  "defaultFlare": 0,
  "defaultJoker": 3000,
  "defaultBingo": 2000,
  "radios": [
    {
      "description": "KY 197A",
      "max": 390,
      "min": 118,
      "name": "COM 1",
      "presetCount": 20,
      "step": 0.025
    }
  ],
  "guns": [],
  "stations": [
    {
      "station": 1,
      "name": "Station 1",
      "munitions": ["{CE2_SMOKE_WHITE}"]
    }
  ]
}
