{
  "aircraft": "Mirage-F1BE",
  "displayName": "Mirage F1BE",
  "isHelicopter": false,
  "emptyWeight": 17637,
  "maxTakeoffWeight": 37479,
  "internalFuel": 6713,
  "cmdsCapacity": 60,
  "chaffIncrement": 30,
  "flareIncrement": 15,
  "defaultChaff": 30,
  "defaultFlare": 15,
  "defaultJoker": 3000,
  "defaultBingo": 2000,
  "radios": [
    {
      "description": "TRAP-136",
      "max": 399.975,
      "min": 118,
      "name": "COM 1",
      "presetCount": 20,
      "step": 0.025
    },
    {
      "description": "TRAP-137B",
      "max": 399.975,
      "min": 225,
      "name": "COM 2",
      "presetCount": 20,
      "step": 0.025
    }
  ],
  "guns": [],
  "stations": [
    {
      "station": 1,
      "name": "Station 1",
      "munitions": [
        "{AIM-9B}",
        "{AIM-9J}",
        "{9BFD8C90-F7AE-4e90-833B-BFD0CED0E536}",
        "{AIM-9P3}",
        "{AIM-9JULI}",
        "{R550_Magic_1}",
        "{FC23864E-3B80-48E3-9C03-4DA8B1D7497B}"
      ]
    },
    {
      "station": 2,
      "name": "Station 2",
      "munitions": [
        "{SAMP125LD}",
        "{SAMP250LD}",
        "{SAMP250HD}",
        "{SAMP400LD}",
        "{SAMP400HD}",
        "{BLU107B_DURANDAL}",
        "{BLG66_AC}",
        "{MATRA_F1_SNEBT250}",
        "{MATRA_F1_SNEBT251}",
        "{MATRA_F1_SNEBT252}",
        "{MATRA_F1_SNEBT253}",
        "{MATRA_F1_SNEBT254_RED}",
        "{MATRA_F1_SNEBT254_YELLOW}",
        "{MATRA_F1_SNEBT254_GREEN}",
        "{MATRA_F1_SNEBT256}",
        "{MATRA_F1_SNEBT257}",
        "{MATRA_F1_SNEBT259E}",
        "{MATRA_F4_SNEBT250}",
        "{MATRA_F4_SNEBT251}",
        "{MATRA_F4_SNEBT252}",
        "{MATRA_F4_SNEBT253}",
        "{MATRA_F4_SNEBT254_RED}",
        "{MATRA_F4_SNEBT254_YELLOW}",
        "{MATRA_F4_SNEBT254_GREEN}",
        "{MATRA_F4_SNEBT256}",
        "{MATRA_F4_SNEBT257}",
        "{BCE4E030-38E9-423E-98ED-24BE3DA87C32}",
        "{7A44FF09-527C-4B7E-B42B-3F111CFE50FB}",
        "BR_250",
        "BR_500",
        "{DB769D48-67D7-42ED-A2BE-108D566C8B1E}"
      ]
    },
    {
      "station": 3,
      "name": "Station 3",
      "munitions": [
        "{SAMP125LD}",
        "{SAMP250LD}",
        "{SAMP250HD}",
        "{SAMP400LD}",
        "{SAMP400HD}",
        "{BLU107B_DURANDAL}",
        "{BLG66_AC}",
        "{AUF2_BLU107}",
        "{AUF2_SAMP125LD}",
        "{AUF2_SAMP250LD}",
        "{AUF2_SAMP250HD}",
        "{AUF2_BLG66}",
        "{MATRA_F1_SNEBT250}",
        "{MATRA_F1_SNEBT251}",
        "{MATRA_F1_SNEBT252}",
        "{MATRA_F1_SNEBT253}",
        "{MATRA_F1_SNEBT254_RED}",
        "{MATRA_F1_SNEBT254_YELLOW}",
        "{MATRA_F1_SNEBT254_GREEN}",
        "{MATRA_F1_SNEBT256}",
        "{MATRA_F1_SNEBT257}",
        "{MATRA_F1_SNEBT259E}",
        "{MATRA_F4_SNEBT250}",
        "{MATRA_F4_SNEBT251}",
        "{MATRA_F4_SNEBT252}",
        "{MATRA_F4_SNEBT253}",
        "{MATRA_F4_SNEBT254_RED}",
        "{MATRA_F4_SNEBT254_YELLOW}",
        "{MATRA_F4_SNEBT254_GREEN}",
        "{MATRA_F4_SNEBT256}",
        "{MATRA_F4_SNEBT257}",
        "PTB-1200-F1",
        "PTB-1200-F1-EMPTY",
        "{CC420_GUN_POD}",
        "{BCE4E030-38E9-423E-98ED-24BE3DA87C32}",
        "{7A44FF09-527C-4B7E-B42B-3F111CFE50FB}",
        "BR_250",
        "BR_500",
        "{DB769D48-67D7-42ED-A2BE-108D566C8B1E}",
        "{0D33DDAE-524F-4A4E-B5B8-621754FE3ADE}",
        "{AUF2_BR250}",
        "{AUF2_MK82}",
        "{AUF2_GBU12}",
        "{14_3_M2_6xBAP100}",
        "{14_3_M2_9xBAP100}",
        "{30_6_M2_12xBAP100}",
        "{30_6_M2_18xBAP100}",
        "{14_3_M2_6xBAT120}",
        "{14_3_M2_9xBAT120}",
        "{30_6_M2_12xBAT120}",
        "{30_6_M2_18xBAT120}",
        "{R530F_EM}",
        "{R530F_IR}",
        "{S530F}"
      ]
    },
    {
      "station": 4,
      "name": "Station 4",
      "munitions": [
        "{SAMP250LD}",
        "{SAMP250HD}",
        "{SAMP400LD}",
        "{SAMP400HD}",
        "{BLG66_AC}",
        "{CLB4_BLU107}",
        "{CLB4_SAMP125LD}",
        "{CLB4_SAMP250LD}",
        "{CLB4_SAMP250HD}",
        "{CLB4_SAMP400LD}",
        "{CLB4_SAMP400HD}",
        "{AUF2_BLU107}",
        "{AUF2_SAMP125LD}",
        "{AUF2_SAMP250LD}",
        "{AUF2_SAMP250HD}",
        "{AUF2_BLG66}",
        "PTB-1200-F1",
        "PTB-1200-F1-EMPTY",
        "{CC420_GUN_POD}",
        "{BCE4E030-38E9-423E-98ED-24BE3DA87C32}",
        "{7A44FF09-527C-4B7E-B42B-3F111CFE50FB}",
        "BR_250",
        "BR_500",
        "{51F9AAE5-964F-4D21-83FB-502E3BFE5F8A}",
        "{DB769D48-67D7-42ED-A2BE-108D566C8B1E}",
        "{0D33DDAE-524F-4A4E-B5B8-621754FE3ADE}",
        "{CLB4_MK82}",
        "{CLB4_BR250}",
        "{AUF2_BR250}",
        "{AUF2_MK82}",
        "{AUF2_GBU12}",
        "{14_3_M2_6xBAP100}",
        "{14_3_M2_9xBAP100}",
        "{30_6_M2_12xBAP100}",
        "{30_6_M2_18xBAP100}",
        "{14_3_M2_6xBAT120}",
        "{14_3_M2_9xBAT120}",
        "{30_6_M2_12xBAT120}",
        "{30_6_M2_18xBAT120}",
        "{R530F_EM}",
        "{R530F_IR}",
        "PTB-580G-F1",
        "PTB-580G-F1-EMPTY"
      ]
    },
    {
      "station": 5,
      "name": "Station 5",
      "munitions": [
        "{SAMP125LD}",
        "{SAMP250LD}",
        "{SAMP250HD}",
        "{SAMP400LD}",
        "{SAMP400HD}",
        "{BLU107B_DURANDAL}",
        "{BLG66_AC}",
        "{AUF2_BLU107}",
        "{AUF2_SAMP125LD}",
        "{AUF2_SAMP250LD}",
        "{AUF2_SAMP250HD}",
        "{AUF2_BLG66}",
        "{MATRA_F1_SNEBT250}",
        "{MATRA_F1_SNEBT251}",
        "{MATRA_F1_SNEBT252}",
        "{MATRA_F1_SNEBT253}",
        "{MATRA_F1_SNEBT254_RED}",
        "{MATRA_F1_SNEBT254_YELLOW}",
        "{MATRA_F1_SNEBT254_GREEN}",
        "{MATRA_F1_SNEBT256}",
        "{MATRA_F1_SNEBT257}",
        "{MATRA_F1_SNEBT259E}",
        "{MATRA_F4_SNEBT250}",
        "{MATRA_F4_SNEBT251}",
        "{MATRA_F4_SNEBT252}",
        "{MATRA_F4_SNEBT253}",
        "{MATRA_F4_SNEBT254_RED}",
        "{MATRA_F4_SNEBT254_YELLOW}",
        "{MATRA_F4_SNEBT254_GREEN}",
        "{MATRA_F4_SNEBT256}",
        "{MATRA_F4_SNEBT257}",
        "PTB-1200-F1",
        "PTB-1200-F1-EMPTY",
        "{CC420_GUN_POD}",
        "{BCE4E030-38E9-423E-98ED-24BE3DA87C32}",
        "{7A44FF09-527C-4B7E-B42B-3F111CFE50FB}",
        "BR_250",
        "BR_500",
        "{DB769D48-67D7-42ED-A2BE-108D566C8B1E}",
        "{0D33DDAE-524F-4A4E-B5B8-621754FE3ADE}",
        "{AUF2_BR250}",
        "{AUF2_MK82}",
        "{AUF2_GBU12}",
        "{14_3_M2_6xBAP100}",
        "{14_3_M2_9xBAP100}",
        "{30_6_M2_12xBAP100}",
        "{30_6_M2_18xBAP100}",
        "{14_3_M2_6xBAT120}",
        "{14_3_M2_9xBAT120}",
        "{30_6_M2_12xBAT120}",
        "{30_6_M2_18xBAT120}",
        "{R530F_EM}",
        "{R530F_IR}",
        "{S530F}"
      ]
    },
    {
      "station": 6,
      "name": "Station 6",
      "munitions": [
        "{SAMP125LD}",
        "{SAMP250LD}",
        "{SAMP250HD}",
        "{SAMP400LD}",
        "{SAMP400HD}",
        "{BLU107B_DURANDAL}",
        "{BLG66_AC}",
        "{MATRA_F1_SNEBT250}",
        "{MATRA_F1_SNEBT251}",
        "{MATRA_F1_SNEBT252}",
        "{MATRA_F1_SNEBT253}",
        "{MATRA_F1_SNEBT254_RED}",
        "{MATRA_F1_SNEBT254_YELLOW}",
        "{MATRA_F1_SNEBT254_GREEN}",
        "{MATRA_F1_SNEBT256}",
        "{MATRA_F1_SNEBT257}",
        "{MATRA_F1_SNEBT259E}",
        "{MATRA_F4_SNEBT250}",
        "{MATRA_F4_SNEBT251}",
        "{MATRA_F4_SNEBT252}",
        "{MATRA_F4_SNEBT253}",
        "{MATRA_F4_SNEBT254_RED}",
        "{MATRA_F4_SNEBT254_YELLOW}",
        "{MATRA_F4_SNEBT254_GREEN}",
        "{MATRA_F4_SNEBT256}",
        "{MATRA_F4_SNEBT257}",
        "{BCE4E030-38E9-423E-98ED-24BE3DA87C32}",
        "{7A44FF09-527C-4B7E-B42B-3F111CFE50FB}",
        "BR_250",
        "BR_500",
        "{DB769D48-67D7-42ED-A2BE-108D566C8B1E}"
      ]
    },
    {
      "station": 7,
      "name": "Station 7",
      "munitions": [
        "{AIM-9B}",
        "{AIM-9J}",
        "{9BFD8C90-F7AE-4e90-833B-BFD0CED0E536}",
        "{AIM-9P3}",
        "{AIM-9JULI}",
        "{R550_Magic_1}",
        "{FC23864E-3B80-48E3-9C03-4DA8B1D7497B}"
      ]
    }
  ]
}
