{
  "aircraft": "F-5E-3",
  "displayName": "F-5E-3",
  "isHelicopter": false,
  "emptyWeight": 10659,
  "maxTakeoffWeight": 24663,
  "internalFuel": 4511,
  "cmdsCapacity": 60,
  "chaffIncrement": 30,
  "flareIncrement": 15,
  "defaultChaff": 30,
  "defaultFlare": 15,
  "defaultJoker": 3000,
  "defaultBingo": 2000,
  "radios": [
    {
      "description": "UHF Radio AN/ARC-164",
      "max": 399.999,
      "min": 225,
      "name": "COM 1",
      "presetCount": 20,
      "step": 0.025
    }
  ],
  "guns": [
    {
      "capacity": 280,
      "mixes": [
        {
          "sequence": ["M39_20_HEI", "M39_20_HEI", "M39_20_HEI", "M39_20_HEI_T"]
        },
        {
          "sequence": ["M39_20_HEI_T", "M39_20_HEI", "M39_20_HEI", "M39_20_API"]
        },
        {
          "sequence": ["M39_20_API"]
        },
        {
          "sequence": ["M39_20_TP", "M39_20_TP_T"]
        }
      ],
      "name": "M-39",
      "shells": [
        {
          "displayName": "20mm HEI",
          "name": "M39_20_HEI"
        },
        {
          "displayName": "20mm HEI T",
          "name": "M39_20_HEI_T"
        },
        {
          "displayName": "20mm API",
          "name": "M39_20_API"
        },
        {
          "displayName": "20mm TP",
          "name": "M39_20_TP"
        },
        {
          "displayName": "20mm TP T",
          "name": "M39_20_TP_T"
        }
      ]
    },
    {
      "capacity": 280,
      "mixes": [
        {
          "sequence": ["M39_20_HEI", "M39_20_HEI", "M39_20_HEI", "M39_20_HEI_T"]
        },
        {
          "sequence": ["M39_20_HEI_T", "M39_20_HEI", "M39_20_HEI", "M39_20_API"]
        },
        {
          "sequence": ["M39_20_API"]
        },
        {
          "sequence": ["M39_20_TP", "M39_20_TP_T"]
        }
      ],
      "name": "M-39",
      "shells": [
        {
          "displayName": "20mm HEI",
          "name": "M39_20_HEI"
        },
        {
          "displayName": "20mm HEI T",
          "name": "M39_20_HEI_T"
        },
        {
          "displayName": "20mm API",
          "name": "M39_20_API"
        },
        {
          "displayName": "20mm TP",
          "name": "M39_20_TP"
        },
        {
          "displayName": "20mm TP T",
          "name": "M39_20_TP_T"
        }
      ]
    }
  ],
  "stations": [
    {
      "station": 1,
      "name": "Station 1",
      "munitions": [
        "{AIM-9B}",
        "{AIM-9J}",
        "{AIM-9P5}",
        "{AIM-9P3}",
        "{9BFD8C90-F7AE-4e90-833B-BFD0CED0E536}",
        "{A4BCC903-06C8-47bb-9937-A30FEDB4E741}",
        "{A4BCC903-06C8-47bb-9937-A30FEDB4E742}",
        "{A4BCC903-06C8-47bb-9937-A30FEDB4E743}",
        "{A4BCC903-06C8-47bb-9937-A30FEDB4E744}",
        "{A4BCC903-06C8-47bb-9937-A30FEDB4E745}",
        "{A4BCC903-06C8-47bb-9937-A30FEDB4E746}",
        "{AIS_ASQ_T50}",
        "CATM-9M"
      ]
    },
    {
      "station": 2,
      "name": "Station 2",
      "munitions": [
        "{BCE4E030-38E9-423E-98ED-24BE3DA87C32}",
        "{Mk82SNAKEYE}",
        "{00F5DAC4-0466-4122-998F-B1A298E34113}",
        "{DB769D48-67D7-42ED-A2BE-108D566C8B1E}",
        "{CBU-52B}",
        "{FC85D2ED-501A-48ce-9863-49D468DDD5FC}",
        "{174C6E6D-0C3D-42ff-BCB3-0853CB371F5C}",
        "{65396399-9F5C-4ec3-A7D2-5A8F4C1D90C4}",
        "{A021F29D-18AB-4d3e-985C-FC9C60E35E9E}",
        "{4F977A2A-CD25-44df-90EF-164BFA2AE72F}",
        "{1F7136CB-8120-4e77-B97B-945FF01FB67C}",
        "{647C5F26-BDD1-41e6-A371-8DE1E4CC0E94}",
        "{0877B74B-5A00-4e61-BA8A-A56450BA9E27}",
        "{LAU68_FFAR_WP156}",
        "{LAU68_FFAR_MK1HE}",
        "{LAU68_FFAR_MK5HEAT}",
        "LAU3_WP156",
        "LAU3_WP1B",
        "LAU3_WP61",
        "LAU3_HE5",
        "LAU3_HE151",
        "{LAU3_FFAR_WP156}",
        "{LAU3_FFAR_MK1HE}",
        "{LAU3_FFAR_MK5HEAT}",
        "{CAE48299-A294-4bad-8EE6-89EFC5DCDF00}",
        "{BDU-33}",
        "{BDU-50LD}",
        "{BDU-50LGB}",
        "{BDU-50HD}"
      ]
    },
    {
      "station": 3,
      "name": "Station 3",
      "munitions": [
        "{BCE4E030-38E9-423E-98ED-24BE3DA87C32}",
        "{Mk82SNAKEYE}",
        "{7A44FF09-527C-4B7E-B42B-3F111CFE50FB}",
        "{00F5DAC4-0466-4122-998F-B1A298E34113}",
        "{DB769D48-67D7-42ED-A2BE-108D566C8B1E}",
        "{0D33DDAE-524F-4A4E-B5B8-621754FE3ADE}",
        "{CBU-52B}",
        "{FC85D2ED-501A-48ce-9863-49D468DDD5FC}",
        "{174C6E6D-0C3D-42ff-BCB3-0853CB371F5C}",
        "{65396399-9F5C-4ec3-A7D2-5A8F4C1D90C4}",
        "{A021F29D-18AB-4d3e-985C-FC9C60E35E9E}",
        "{4F977A2A-CD25-44df-90EF-164BFA2AE72F}",
        "{1F7136CB-8120-4e77-B97B-945FF01FB67C}",
        "{647C5F26-BDD1-41e6-A371-8DE1E4CC0E94}",
        "{0877B74B-5A00-4e61-BA8A-A56450BA9E27}",
        "{LAU68_FFAR_WP156}",
        "{LAU68_FFAR_MK1HE}",
        "{LAU68_FFAR_MK5HEAT}",
        "LAU3_WP156",
        "LAU3_WP1B",
        "LAU3_WP61",
        "LAU3_HE5",
        "LAU3_HE151",
        "{LAU3_FFAR_WP156}",
        "{LAU3_FFAR_MK1HE}",
        "{LAU3_FFAR_MK5HEAT}",
        "{0395076D-2F77-4420-9D33-087A4398130B}",
        "{PTB-150GAL}",
        "MXU-648-TP",
        "{BDU-33}",
        "{BDU-50LD}",
        "{BDU-50LGB}",
        "{BDU-50HD}"
      ]
    },
    {
      "station": 4,
      "name": "Station 4",
      "munitions": [
        "{BCE4E030-38E9-423E-98ED-24BE3DA87C32}",
        "{Mk82SNAKEYE}",
        "{7A44FF09-527C-4B7E-B42B-3F111CFE50FB}",
        "{AB8B8299-F1CC-4359-89B5-2172E0CF4A5A}",
        "{00F5DAC4-0466-4122-998F-B1A298E34113}",
        "{DB769D48-67D7-42ED-A2BE-108D566C8B1E}",
        "{0D33DDAE-524F-4A4E-B5B8-621754FE3ADE}",
        "{51F9AAE5-964F-4D21-83FB-502E3BFE5F8A}",
        "{MER-5E_MK82x5}",
        "{MER-5E_Mk82SNAKEYEx5}",
        "{CBU-52B}",
        "{0395076D-2F77-4420-9D33-087A4398130B}",
        "{PTB-150GAL}",
        "MXU-648-TP",
        "{BDU-33}",
        "{BDU-50LD}",
        "{BDU-50HD}"
      ]
    },
    {
      "station": 5,
      "name": "Station 5",
      "munitions": [
        "{BCE4E030-38E9-423E-98ED-24BE3DA87C32}",
        "{Mk82SNAKEYE}",
        "{7A44FF09-527C-4B7E-B42B-3F111CFE50FB}",
        "{00F5DAC4-0466-4122-998F-B1A298E34113}",
        "{DB769D48-67D7-42ED-A2BE-108D566C8B1E}",
        "{0D33DDAE-524F-4A4E-B5B8-621754FE3ADE}",
        "{CBU-52B}",
        "{FC85D2ED-501A-48ce-9863-49D468DDD5FC}",
        "{174C6E6D-0C3D-42ff-BCB3-0853CB371F5C}",
        "{65396399-9F5C-4ec3-A7D2-5A8F4C1D90C4}",
        "{A021F29D-18AB-4d3e-985C-FC9C60E35E9E}",
        "{4F977A2A-CD25-44df-90EF-164BFA2AE72F}",
        "{1F7136CB-8120-4e77-B97B-945FF01FB67C}",
        "{647C5F26-BDD1-41e6-A371-8DE1E4CC0E94}",
        "{0877B74B-5A00-4e61-BA8A-A56450BA9E27}",
        "{LAU68_FFAR_WP156}",
        "{LAU68_FFAR_MK1HE}",
        "{LAU68_FFAR_MK5HEAT}",
        "LAU3_WP156",
        "LAU3_WP1B",
        "LAU3_WP61",
        "LAU3_HE5",
        "LAU3_HE151",
        "{LAU3_FFAR_WP156}",
        "{LAU3_FFAR_MK1HE}",
        "{LAU3_FFAR_MK5HEAT}",
        "{0395076D-2F77-4420-9D33-087A4398130B}",
        "{PTB-150GAL}",
        "MXU-648-TP",
        "{BDU-33}",
        "{BDU-50LD}",
        "{BDU-50LGB}",
        "{BDU-50HD}"
      ]
    },
    {
      "station": 6,
      "name": "Station 6",
      "munitions": [
        "{BCE4E030-38E9-423E-98ED-24BE3DA87C32}",
        "{Mk82SNAKEYE}",
        "{00F5DAC4-0466-4122-998F-B1A298E34113}",
        "{DB769D48-67D7-42ED-A2BE-108D566C8B1E}",
        "{CBU-52B}",
        "{FC85D2ED-501A-48ce-9863-49D468DDD5FC}",
        "{174C6E6D-0C3D-42ff-BCB3-0853CB371F5C}",
        "{65396399-9F5C-4ec3-A7D2-5A8F4C1D90C4}",
        "{A021F29D-18AB-4d3e-985C-FC9C60E35E9E}",
        "{4F977A2A-CD25-44df-90EF-164BFA2AE72F}",
        "{1F7136CB-8120-4e77-B97B-945FF01FB67C}",
        "{647C5F26-BDD1-41e6-A371-8DE1E4CC0E94}",
        "{0877B74B-5A00-4e61-BA8A-A56450BA9E27}",
        "{LAU68_FFAR_WP156}",
        "{LAU68_FFAR_MK1HE}",
        "{LAU68_FFAR_MK5HEAT}",
        "LAU3_WP156",
        "LAU3_WP1B",
        "LAU3_WP61",
        "LAU3_HE5",
        "LAU3_HE151",
        "{LAU3_FFAR_WP156}",
        "{LAU3_FFAR_MK1HE}",
        "{LAU3_FFAR_MK5HEAT}",
        "{CAE48299-A294-4bad-8EE6-89EFC5DCDF00}",
        "{BDU-33}",
        "{BDU-50LD}",
        "{BDU-50LGB}",
        "{BDU-50HD}"
      ]
    },
    {
      "station": 7,
      "name": "Station 7",
      "munitions": [
        "{AIM-9B}",
        "{AIM-9J}",
        "{AIM-9P5}",
        "{AIM-9P3}",
        "{9BFD8C90-F7AE-4e90-833B-BFD0CED0E536}",
        "{A4BCC903-06C8-47bb-9937-A30FEDB4E741}",
        "{A4BCC903-06C8-47bb-9937-A30FEDB4E742}",
        "{A4BCC903-06C8-47bb-9937-A30FEDB4E743}",
        "{A4BCC903-06C8-47bb-9937-A30FEDB4E744}",
        "{A4BCC903-06C8-47bb-9937-A30FEDB4E745}",
        "{A4BCC903-06C8-47bb-9937-A30FEDB4E746}",
        "{AIS_ASQ_T50}",
        "CATM-9M"
      ]
    },
    {
      "station": 8,
      "name": "SMK",
      "munitions": [
        "{INV-SMOKE-RED}",
        "{INV-SMOKE-GREEN}",
        "{INV-SMOKE-BLUE}",
        "{INV-SMOKE-WHITE}",
        "{INV-SMOKE-YELLOW}",
        "{INV-SMOKE-ORANGE}"
      ]
    }
  ],
  "ammoTypes": [
    "HEI - High Explosive Incendiary",
    "CM - Combat Mix",
    "AP (Armor Piercing)",
    "TP - Target Practice"
  ]
}
