{
  "aircraft": "MiG-19P",
  "displayName": "MiG-19P",
  "isHelicopter": false,
  "emptyWeight": 11579,
  "maxTakeoffWeight": 19264,
  "internalFuel": 3968,
  "cmdsCapacity": 0,
  "chaffIncrement": 1,
  "flareIncrement": 1,
  "defaultChaff": 0,
  "defaultFlare": 0,
  "defaultJoker": 3000,
  "defaultBingo": 2000,
  "radios": [
    {
      "description": "RSIU-4V Radio",
      "max": 150,
      "min": 100,
      "name": "COM 1",
      "presetCount": 6,
      "step": 0.025
    }
  ],
  "guns": [
    {
      "capacity": 70,
      "mixes": [
        {
          "sequence": [
            "NR30_30x155_APT",
            "NR30_30x155_APHE",
            "NR30_30x155_HEI_T",
            "NR30_30x155_HEI_T",
            "NR30_30x155_HEI_T"
          ]
        },
        {
          "sequence": ["NR30_30x155_HEI_T"]
        },
        {
          "sequence": ["NR30_30x155_APT"]
        },
        {
          "sequence": ["NR30_30x155_APHE"]
        }
      ],
      "name": "NR-30",
      "shells": [
        {
          "displayName": "OFZT 30x155 HEI-T",
          "name": "NR30_30x155_HEI_T"
        },
        {
          "displayName": "BT 30x155 AP-T",
          "name": "NR30_30x155_APT"
        },
        {
          "displayName": "BR 30x155 APHE",
          "name": "NR30_30x155_APHE"
        }
      ]
    },
    {
      "capacity": 70,
      "mixes": [
        {
          "sequence": [
            "NR30_30x155_APT",
            "NR30_30x155_APHE",
            "NR30_30x155_HEI_T",
            "NR30_30x155_HEI_T",
            "NR30_30x155_HEI_T"
          ]
        },
        {
          "sequence": ["NR30_30x155_HEI_T"]
        },
        {
          "sequence": ["NR30_30x155_APT"]
        },
        {
          "sequence": ["NR30_30x155_APHE"]
        }
      ],
      "name": "NR-30",
      "shells": [
        {
          "displayName": "OFZT 30x155 HEI-T",
          "name": "NR30_30x155_HEI_T"
        },
        {
          "displayName": "BT 30x155 AP-T",
          "name": "NR30_30x155_APT"
        },
        {
          "displayName": "BR 30x155 APHE",
          "name": "NR30_30x155_APHE"
        }
      ]
    }
  ],
  "stations": [
    {
      "station": 1,
      "name": "Station 1",
      "munitions": [
        "{K-13A}",
        "{D3F65166-1AB8-490f-AF2F-2FB6E22568B1}",
        "{D3F65166-1AB8-490f-AF2F-2FB6E22568B2}",
        "{D3F65166-1AB8-490f-AF2F-2FB6E22568B3}",
        "{D3F65166-1AB8-490f-AF2F-2FB6E22568B4}",
        "{D3F65166-1AB8-490f-AF2F-2FB6E22568B5}",
        "{D3F65166-1AB8-490f-AF2F-2FB6E22568B6}"
      ]
    },
    {
      "station": 2,
      "name": "Station 2",
      "munitions": [
        "FAB_50",
        "FAB_100M",
        "{3C612111-C7AD-476E-8A8E-2485812F4E5C}",
        "{ORO57K_S5M_HEFRAG}",
        "PTB760_MIG19"
      ]
    },
    {
      "station": 3,
      "name": "Station 3",
      "munitions": ["{ORO57K_S5M_HEFRAG}"]
    },
    {
      "station": 4,
      "name": "Station 4",
      "munitions": ["{ORO57K_S5M_HEFRAG}"]
    },
    {
      "station": 5,
      "name": "Station 5",
      "munitions": [
        "FAB_50",
        "FAB_100M",
        "{3C612111-C7AD-476E-8A8E-2485812F4E5C}",
        "{ORO57K_S5M_HEFRAG}",
        "PTB760_MIG19"
      ]
    },
    {
      "station": 6,
      "name": "Station 6",
      "munitions": [
        "{K-13A}",
        "{D3F65166-1AB8-490f-AF2F-2FB6E22568B1}",
        "{D3F65166-1AB8-490f-AF2F-2FB6E22568B2}",
        "{D3F65166-1AB8-490f-AF2F-2FB6E22568B3}",
        "{D3F65166-1AB8-490f-AF2F-2FB6E22568B4}",
        "{D3F65166-1AB8-490f-AF2F-2FB6E22568B5}",
        "{D3F65166-1AB8-490f-AF2F-2FB6E22568B6}"
      ]
    }
  ],
  "ammoTypes": [
    "AP-T, APHE, HEI-T, HEI-T, HEI-T",
    "OFZT 30x155 HEI-T",
    "BT 30x155 AP-T",
    "BR 30x155 APHE"
  ]
}
