{
  "aircraft": "AH-64D_BLK_II",
  "displayName": "AH-64D BLK.II",
  "isHelicopter": true,
  "emptyWeight": 13074,
  "maxTakeoffWeight": 20260,
  "internalFuel": 2513,
  "cmdsCapacity": 90,
  "chaffIncrement": 30,
  "flareIncrement": 30,
  "defaultChaff": 30,
  "defaultFlare": 60,
  "defaultJoker": 3000,
  "defaultBingo": 2000,
  "radios": [
    {
      "description": "ARC-186",
      "max": 151.975,
      "min": 108,
      "name": "COM 1",
      "presetCount": 10,
      "step": 0.025
    },
    {
      "description": "ARC-164",
      "max": 399.975,
      "min": 225,
      "name": "COM 2",
      "presetCount": 10,
      "step": 0.025
    },
    {
      "description": "FM 1: ARC-201D",
      "max": 87.975,
      "min": 30,
      "name": "COM 3",
      "presetCount": 10,
      "step": 0.1
    },
    {
      "description": "FM 2: ARC-201D",
      "max": 87.975,
      "min": 30,
      "name": "COM 4",
      "presetCount": 10,
      "step": 0.1
    }
  ],
  "guns": [
    {
      "capacity": 1200,
      "mixes": [
        {
          "sequence": ["M230_HEDP M789"]
        },
        {
          "sequence": ["M230_TP M788"]
        }
      ],
      "name": "M230",
      "shells": [
        {
          "displayName": "M230_HEDP M789",
          "name": "M230_HEDP M789"
        },
        {
          "displayName": "M230_TP M788",
          "name": "M230_TP M788"
        }
      ]
    }
  ],
  "stations": [
    {
      "station": 1,
      "name": "1",
      "munitions": [
        "M261_MK151",
        "{M261_M257}",
        "{M261_M274}",
        "{M261_M229}",
        "{M261_M151_M433}",
        "{M261_OUTBOARD_AB_M151_E_M274}",
        "{M261_OUTBOARD_AB_M151_E_M257}",
        "{88D18A5E-99C8-4B04-B40B-1C02F2018B6E}",
        "{M299_4xAGM_114L}",
        "{M299_3xAGM_114K_OUTBOARD_PORT}",
        "{M299_3xAGM_114L_OUTBOARD_PORT}",
        "{M299_2xAGM_114K}",
        "{M299_2xAGM_114L}",
        "{M299_1xAGM_114K_OUTBOARD_PORT}",
        "{M299_1xAGM_114L_OUTBOARD_PORT}",
        "{M299_2xAGM_114K_2xAGM_114L}",
        "{M299_1xAGM_114K_3xAGM_114L_PRT}",
        "{M299_3xAGM_114K_1xAGM_114L_PRT}",
        "{M299_EMPTY}",
        "{EFT_230GAL}"
      ]
    },
    {
      "station": 2,
      "name": "2",
      "munitions": [
        "M261_MK151",
        "{M261_M257}",
        "{M261_M274}",
        "{M261_M229}",
        "{M261_M151_M433}",
        "{M261_INBOARD_DE_M151_C_M274}",
        "{M261_INBOARD_DE_M151_C_M257}",
        "{88D18A5E-99C8-4B04-B40B-1C02F2018B6E}",
        "{M299_4xAGM_114L}",
        "{M299_3xAGM_114K_OUTBOARD_PORT}",
        "{M299_3xAGM_114L_OUTBOARD_PORT}",
        "{M299_2xAGM_114K}",
        "{M299_2xAGM_114L}",
        "{M299_1xAGM_114K_OUTBOARD_PORT}",
        "{M299_1xAGM_114L_OUTBOARD_PORT}",
        "{M299_2xAGM_114K_2xAGM_114L}",
        "{M299_1xAGM_114K_3xAGM_114L_PRT}",
        "{M299_3xAGM_114K_1xAGM_114L_PRT}",
        "{M299_EMPTY}",
        "{EFT_230GAL}"
      ]
    },
    {
      "station": 3,
      "name": "3",
      "munitions": [
        "M261_MK151",
        "{M261_M257}",
        "{M261_M274}",
        "{M261_M229}",
        "{M261_M151_M433}",
        "{M261_INBOARD_DE_M151_C_M274}",
        "{M261_INBOARD_DE_M151_C_M257}",
        "{88D18A5E-99C8-4B04-B40B-1C02F2018B6E}",
        "{M299_4xAGM_114L}",
        "{M299_3xAGM_114K_OUTBOARD_STARBOARD}",
        "{M299_3xAGM_114L_OUTBOARD_STARBOARD}",
        "{M299_2xAGM_114K}",
        "{M299_2xAGM_114L}",
        "{M299_1xAGM_114K_OUTBOARD_STARBOARD}",
        "{M299_1xAGM_114L_OUTBOARD_STARBOARD}",
        "{M299_2xAGM_114K_2xAGM_114L}",
        "{M299_1xAGM_114K_3xAGM_114L_STRBRD}",
        "{M299_3xAGM_114K_1xAGM_114L_STRBRD}",
        "{M299_EMPTY}",
        "{EFT_230GAL}"
      ]
    },
    {
      "station": 4,
      "name": "4",
      "munitions": [
        "M261_MK151",
        "{M261_M257}",
        "{M261_M274}",
        "{M261_M229}",
        "{M261_M151_M433}",
        "{M261_OUTBOARD_AB_M151_E_M274}",
        "{M261_OUTBOARD_AB_M151_E_M257}",
        "{88D18A5E-99C8-4B04-B40B-1C02F2018B6E}",
        "{M299_4xAGM_114L}",
        "{M299_3xAGM_114K_OUTBOARD_STARBOARD}",
        "{M299_3xAGM_114L_OUTBOARD_STARBOARD}",
        "{M299_2xAGM_114K}",
        "{M299_2xAGM_114L}",
        "{M299_1xAGM_114K_OUTBOARD_STARBOARD}",
        "{M299_1xAGM_114L_OUTBOARD_STARBOARD}",
        "{M299_2xAGM_114K_2xAGM_114L}",
        "{M299_1xAGM_114K_3xAGM_114L_STRBRD}",
        "{M299_3xAGM_114K_1xAGM_114L_STRBRD}",
        "{M299_EMPTY}",
        "{EFT_230GAL}"
      ]
    },
    {
      "station": 5,
      "name": "IAFS",
      "munitions": ["{IAFS_ComboPak_100}"]
    },
    {
      "station": 6,
      "name": "MMA",
      "munitions": ["{AN_APG_78}"]
    }
  ],
  "ammoTypes": ["M789 HEDP", "M788 TP"]
}
