{
  "aircraft": "J-11A",
  "displayName": "J-11A",
  "isHelicopter": false,
  "emptyWeight": 38581,
  "maxTakeoffWeight": 72752,
  "internalFuel": 20723,
  "cmdsCapacity": 192,
  "chaffIncrement": 3,
  "flareIncrement": 3,
  "defaultChaff": 96,
  "defaultFlare": 96,
  "defaultJoker": 3000,
  "defaultBingo": 2000,
  "radios": [],
  "guns": [
    {
      "capacity": 150,
      "name": "GSh-30-1",
      "shells": [
        {
          "displayName": "30mm HE",
          "name": "GSH301_30_HE"
        }
      ]
    }
  ],
  "stations": [
    {
      "station": 1,
      "name": "Station 1",
      "munitions": [
        "{FBC29BFE-3D24-4C64-B81D-941239D12249}",
        "{RKL609_L}",
        "{D3F65166-1AB8-490f-AF2F-2FB6E22568B1}",
        "{D3F65166-1AB8-490f-AF2F-2FB6E22568B2}",
        "{D3F65166-1AB8-490f-AF2F-2FB6E22568B3}",
        "{D3F65166-1AB8-490f-AF2F-2FB6E22568B4}",
        "{D3F65166-1AB8-490f-AF2F-2FB6E22568B5}",
        "{D3F65166-1AB8-490f-AF2F-2FB6E22568B6}"
      ]
    },
    {
      "station": 2,
      "name": "Station 2",
      "munitions": [
        "{FBC29BFE-3D24-4C64-B81D-941239D12249}",
        "{D3F65166-1AB8-490f-AF2F-2FB6E22568B1}",
        "{D3F65166-1AB8-490f-AF2F-2FB6E22568B2}",
        "{D3F65166-1AB8-490f-AF2F-2FB6E22568B3}",
        "{D3F65166-1AB8-490f-AF2F-2FB6E22568B4}",
        "{D3F65166-1AB8-490f-AF2F-2FB6E22568B5}",
        "{D3F65166-1AB8-490f-AF2F-2FB6E22568B6}"
      ]
    },
    {
      "station": 3,
      "name": "Station 3",
      "munitions": [
        "{FBC29BFE-3D24-4C64-B81D-941239D12249}",
        "{9B25D316-0434-4954-868F-D51DB1A38DF0}",
        "{E8069896-8435-4B90-95C0-01A03AE6E400}",
        "{88DAC840-9F75-4531-8689-B46E64E42E53}",
        "{B79C379A-9E87-4E50-A1EE-7F7E29C2E87A}",
        "{B4C01D60-A8A3-4237-BD72-CA7655BC0FE9}",
        "{35B698AC-9FEF-4EC4-AD29-484A0085F62B}",
        "{BD289E34-DF84-4C5E-9220-4B14C346E79D}",
        "{37DCC01E-9E02-432F-B61D-10C166CA2798}",
        "{3C612111-C7AD-476E-8A8E-2485812F4E5C}",
        "{4203753F-8198-4E85-9924-6F8FF679F9FF}",
        "{RBK_250_275_AO_1SCH}",
        "{D5435F26-F120-4FA3-9867-34ACE562EF1B}",
        "{7AEC222D-C523-425e-B714-719C0D1EB14D}",
        "{RBK_500U_OAB_2_5RT}",
        "{F99BEC1A-869D-4AC7-9730-FBA0E3B1F5FC}",
        "{53BE25A4-C86C-4571-9BC0-47D668349595}",
        "{0511E528-EA28-4caf-A212-00D1408DF10A}",
        "{FC56DF80-9B09-44C5-8976-DCFAFF219062}",
        "{A0648264-4BC0-4EE8-A543-D119F6BA4257}",
        "{F72F47E5-C83A-4B85-96ED-D3E46671EE9A}",
        "{3DFB7320-AB0E-11d7-9897-000476191836}",
        "B-8M1 - 20 S-8OFP2",
        "{FAB_250_DUAL_L}",
        "{FAB_500_DUAL_L}",
        "{RBK_250_PTAB25M_DUAL_L}",
        "{RBK_500_PTAB105_DUAL_L}",
        "{B13_5_S13OF_DUAL_L}",
        "{B8M1_20_S8KOM_DUAL_L}",
        "{B8M1_20_S8TsM_DUAL_L}",
        "{B8M1_20_S8OFP2_DUAL_L}",
        "{S25_DUAL_L}"
      ]
    },
    {
      "station": 4,
      "name": "Station 4",
      "munitions": [
        "{9B25D316-0434-4954-868F-D51DB1A38DF0}",
        "{E8069896-8435-4B90-95C0-01A03AE6E400}",
        "{B4C01D60-A8A3-4237-BD72-CA7655BC0FE9}",
        "{37DCC01E-9E02-432F-B61D-10C166CA2798}",
        "{3C612111-C7AD-476E-8A8E-2485812F4E5C}",
        "{35B698AC-9FEF-4EC4-AD29-484A0085F62B}",
        "{BD289E34-DF84-4C5E-9220-4B14C346E79D}",
        "{F99BEC1A-869D-4AC7-9730-FBA0E3B1F5FC}",
        "{RBK_250_275_AO_1SCH}",
        "{D5435F26-F120-4FA3-9867-34ACE562EF1B}",
        "{7AEC222D-C523-425e-B714-719C0D1EB14D}",
        "{RBK_500U_OAB_2_5RT}",
        "{0511E528-EA28-4caf-A212-00D1408DF10A}"
      ]
    },
    {
      "station": 5,
      "name": "Station 5",
      "munitions": [
        "{9B25D316-0434-4954-868F-D51DB1A38DF0}",
        "{E8069896-8435-4B90-95C0-01A03AE6E400}",
        "{B4C01D60-A8A3-4237-BD72-CA7655BC0FE9}",
        "{37DCC01E-9E02-432F-B61D-10C166CA2798}",
        "{3C612111-C7AD-476E-8A8E-2485812F4E5C}",
        "{35B698AC-9FEF-4EC4-AD29-484A0085F62B}",
        "{BD289E34-DF84-4C5E-9220-4B14C346E79D}",
        "{F99BEC1A-869D-4AC7-9730-FBA0E3B1F5FC}",
        "{RBK_250_275_AO_1SCH}",
        "{D5435F26-F120-4FA3-9867-34ACE562EF1B}",
        "{7AEC222D-C523-425e-B714-719C0D1EB14D}",
        "{RBK_500U_OAB_2_5RT}",
        "{0511E528-EA28-4caf-A212-00D1408DF10A}",
        "{D3F65166-1AB8-490f-AF2F-2FB6E22568B1}",
        "{D3F65166-1AB8-490f-AF2F-2FB6E22568B2}",
        "{D3F65166-1AB8-490f-AF2F-2FB6E22568B3}",
        "{D3F65166-1AB8-490f-AF2F-2FB6E22568B4}",
        "{D3F65166-1AB8-490f-AF2F-2FB6E22568B5}",
        "{D3F65166-1AB8-490f-AF2F-2FB6E22568B6}"
      ]
    },
    {
      "station": 6,
      "name": "Station 6",
      "munitions": [
        "{9B25D316-0434-4954-868F-D51DB1A38DF0}",
        "{E8069896-8435-4B90-95C0-01A03AE6E400}",
        "{B4C01D60-A8A3-4237-BD72-CA7655BC0FE9}",
        "{37DCC01E-9E02-432F-B61D-10C166CA2798}",
        "{3C612111-C7AD-476E-8A8E-2485812F4E5C}",
        "{35B698AC-9FEF-4EC4-AD29-484A0085F62B}",
        "{BD289E34-DF84-4C5E-9220-4B14C346E79D}",
        "{F99BEC1A-869D-4AC7-9730-FBA0E3B1F5FC}",
        "{53BE25A4-C86C-4571-9BC0-47D668349595}",
        "{RBK_250_275_AO_1SCH}",
        "{D5435F26-F120-4FA3-9867-34ACE562EF1B}",
        "{7AEC222D-C523-425e-B714-719C0D1EB14D}",
        "{RBK_500U_OAB_2_5RT}",
        "{0511E528-EA28-4caf-A212-00D1408DF10A}",
        "{D3F65166-1AB8-490f-AF2F-2FB6E22568B1}",
        "{D3F65166-1AB8-490f-AF2F-2FB6E22568B2}",
        "{D3F65166-1AB8-490f-AF2F-2FB6E22568B3}",
        "{D3F65166-1AB8-490f-AF2F-2FB6E22568B4}",
        "{D3F65166-1AB8-490f-AF2F-2FB6E22568B5}",
        "{D3F65166-1AB8-490f-AF2F-2FB6E22568B6}"
      ]
    },
    {
      "station": 7,
      "name": "Station 7",
      "munitions": [
        "{9B25D316-0434-4954-868F-D51DB1A38DF0}",
        "{E8069896-8435-4B90-95C0-01A03AE6E400}",
        "{B4C01D60-A8A3-4237-BD72-CA7655BC0FE9}",
        "{37DCC01E-9E02-432F-B61D-10C166CA2798}",
        "{3C612111-C7AD-476E-8A8E-2485812F4E5C}",
        "{35B698AC-9FEF-4EC4-AD29-484A0085F62B}",
        "{BD289E34-DF84-4C5E-9220-4B14C346E79D}",
        "{F99BEC1A-869D-4AC7-9730-FBA0E3B1F5FC}",
        "{RBK_250_275_AO_1SCH}",
        "{D5435F26-F120-4FA3-9867-34ACE562EF1B}",
        "{7AEC222D-C523-425e-B714-719C0D1EB14D}",
        "{RBK_500U_OAB_2_5RT}",
        "{0511E528-EA28-4caf-A212-00D1408DF10A}"
      ]
    },
    {
      "station": 8,
      "name": "Station 8",
      "munitions": [
        "{FBC29BFE-3D24-4C64-B81D-941239D12249}",
        "{9B25D316-0434-4954-868F-D51DB1A38DF0}",
        "{E8069896-8435-4B90-95C0-01A03AE6E400}",
        "{88DAC840-9F75-4531-8689-B46E64E42E53}",
        "{B79C379A-9E87-4E50-A1EE-7F7E29C2E87A}",
        "{B4C01D60-A8A3-4237-BD72-CA7655BC0FE9}",
        "{35B698AC-9FEF-4EC4-AD29-484A0085F62B}",
        "{BD289E34-DF84-4C5E-9220-4B14C346E79D}",
        "{37DCC01E-9E02-432F-B61D-10C166CA2798}",
        "{3C612111-C7AD-476E-8A8E-2485812F4E5C}",
        "{4203753F-8198-4E85-9924-6F8FF679F9FF}",
        "{RBK_250_275_AO_1SCH}",
        "{D5435F26-F120-4FA3-9867-34ACE562EF1B}",
        "{7AEC222D-C523-425e-B714-719C0D1EB14D}",
        "{RBK_500U_OAB_2_5RT}",
        "{F99BEC1A-869D-4AC7-9730-FBA0E3B1F5FC}",
        "{53BE25A4-C86C-4571-9BC0-47D668349595}",
        "{0511E528-EA28-4caf-A212-00D1408DF10A}",
        "{FC56DF80-9B09-44C5-8976-DCFAFF219062}",
        "{A0648264-4BC0-4EE8-A543-D119F6BA4257}",
        "{F72F47E5-C83A-4B85-96ED-D3E46671EE9A}",
        "{3DFB7320-AB0E-11d7-9897-000476191836}",
        "B-8M1 - 20 S-8OFP2",
        "{FAB_250_DUAL_R}",
        "{FAB_500_DUAL_R}",
        "{RBK_250_PTAB25M_DUAL_R}",
        "{RBK_500_PTAB105_DUAL_R}",
        "{B13_5_S13OF_DUAL_R}",
        "{B8M1_20_S8KOM_DUAL_R}",
        "{B8M1_20_S8TsM_DUAL_R}",
        "{B8M1_20_S8OFP2_DUAL_R}",
        "{S25_DUAL_R}"
      ]
    },
    {
      "station": 9,
      "name": "Station 9",
      "munitions": [
        "{FBC29BFE-3D24-4C64-B81D-941239D12249}",
        "{D3F65166-1AB8-490f-AF2F-2FB6E22568B1}",
        "{D3F65166-1AB8-490f-AF2F-2FB6E22568B2}",
        "{D3F65166-1AB8-490f-AF2F-2FB6E22568B3}",
        "{D3F65166-1AB8-490f-AF2F-2FB6E22568B4}",
        "{D3F65166-1AB8-490f-AF2F-2FB6E22568B5}",
        "{D3F65166-1AB8-490f-AF2F-2FB6E22568B6}"
      ]
    },
    {
      "station": 10,
      "name": "Station 10",
      "munitions": [
        "{FBC29BFE-3D24-4C64-B81D-941239D12249}",
        "{RKL609_R}",
        "{D3F65166-1AB8-490f-AF2F-2FB6E22568B1}",
        "{D3F65166-1AB8-490f-AF2F-2FB6E22568B2}",
        "{D3F65166-1AB8-490f-AF2F-2FB6E22568B3}",
        "{D3F65166-1AB8-490f-AF2F-2FB6E22568B4}",
        "{D3F65166-1AB8-490f-AF2F-2FB6E22568B5}",
        "{D3F65166-1AB8-490f-AF2F-2FB6E22568B6}"
      ]
    }
  ]
}
